{
  "schemaVersion": 1,
  "title": "Agent Harness 通用现场手册（种子）",
  "summary": "冷启动种子模板的现场规则：凭据纪律、Subagent 派发、证据优先、输出口径、harness 机制。新项目复制本 Mod 后只改自己的项目章节与配置，这五章可原样沿用；游玩指南见使用方的根文档。",
  "source": {
    "document": "seed template",
    "revision": "2026-10-30",
    "note": "本资源是**种子模板**而非某个仓库的规则投影：五章全部为通用元工作流纪律，不含任何具体仓库的目录结构、端口、远端地址、部署通道或门禁命令。使用方复制本 Mod 后，另在自己的 Mod 里编写项目章节（仓库形态 / 分支与泳道 / 集成与部署 / 门禁命令 / 指针 / 硬约束），两者通过 section id 取用、互不覆盖。harness 章只描述 harness 机制本身（两层状态机 / 动作协议 / 异步入口 / 结算 / 改 Mod 三件套 / host 契约），是「怎么用这套 harness」而不是「本仓库怎么规定」。"
  },
  "sections": [
    {
      "id": "credentials",
      "order": 1,
      "title": "一、凭据纪律",
      "summary": "最高优先级、不可协商：凭据不进仓库、不进对话产物、不进任何入库面；只出现键名，示例数据一律自造合成。",
      "source": "通用基线（种子模板）",
      "priority": "critical",
      "rules": [
        {
          "id": "credentials.no-secret-in-repo",
          "modality": "must-not",
          "text": "禁止把任何凭据、密钥、令牌写入仓库——包括代码、文档、commit message 与 Mod 示例数据。",
          "basis": "种子模板基线"
        },
        {
          "id": "credentials.no-secret-in-artifacts",
          "modality": "must-not",
          "text": "禁止把凭据写入任何对话产物：汇报、报告、issue/PR 描述、回贴的日志片段。",
          "basis": "种子模板基线"
        },
        {
          "id": "credentials.no-secret-in-committed-resources",
          "modality": "must-not",
          "text": "任何敏感信息不得写入入库资源——入库面明确包含：静态配置、`data/playbook.json` 规则资源、经验/成长（演进）Mod 及其产出、其他随仓库提交的 Mod 资源与文档。",
          "basis": "种子模板基线"
        },
        {
          "id": "credentials.settings-not-a-secret-vault",
          "modality": "must",
          "text": "运行期动态 KV `settings.*` 不是存放敏感值的例外：静态默认与动态覆盖一律只存非敏感的行为开关、数值与说明文本。",
          "basis": "种子模板基线（两层配置：动态覆盖 > 静态默认）"
        },
        {
          "id": "credentials.env-file",
          "modality": "must",
          "text": "本地凭据一律走 `.env` / `.env.local`（均 gitignore，权限 600）；`.env.example` 只放键名不放值。",
          "basis": "种子模板基线"
        },
        {
          "id": "credentials.keys-only",
          "modality": "must",
          "text": "汇报、文档、commit message、Mod 资源与叙事文本中只出现键名，不出现值——包括局末复盘与走查报告。",
          "basis": "种子模板基线"
        },
        {
          "id": "credentials.audit-by-key-name",
          "modality": "must",
          "text": "核查环境变量面时只读「键名 + 长度」，绝不把原始输出整段摊开或喂给会持久化的工具。",
          "basis": "种子模板基线（凭据泄露事故的处置纪律）"
        },
        {
          "id": "credentials.synthetic-data",
          "modality": "must",
          "text": "示例与测试数据一律自造合成数据，不引入任何真实个人数据或真实业务指标。",
          "basis": "种子模板基线"
        },
        {
          "id": "credentials.breach-disclosure",
          "modality": "must",
          "text": "违规后如实列出暴露了什么（具体文件 + 内容位置 + 实际返回内容），不淡化、不辩解；随后停止相关操作，等待用户指示。",
          "basis": "种子模板基线"
        }
      ],
      "notes": "受管凭据面的常见枚举（非穷尽）：LLM API key、模型与 thinking 参数、平台服务数据库连接串与对象存储 AK/SK、任何第三方服务的 token。入库面与配置面同构：静态默认配置文件、`settings.*` 动态覆盖、规则资源（playbook）与演进产物——四处都只承载非敏感内容。"
    },
    {
      "id": "dispatch",
      "order": 2,
      "title": "二、Subagent 派发纪律",
      "summary": "后台派发不阻塞主会话；派发参数从本地 env 读、只用于派发；一个工作区同时只承载一个任务；执行方不做收口。",
      "source": "通用基线（种子模板）",
      "priority": "standard",
      "applies_to": [
        "implement"
      ],
      "rules": [
        {
          "id": "dispatch.background-only",
          "modality": "must",
          "text": "创建 subagent 执行任务一律后台运行，主会话不原地等待——派发期间继续推进其他泳道、核验或规划，收到完成通知后再核验合流。",
          "basis": "种子模板基线"
        },
        {
          "id": "dispatch.sync-wait-exception",
          "modality": "should",
          "text": "仅当后续动作严格依赖其结果且无任何可并行推进的工作时，才允许同步等待，并优先把该时间用于其他泳道。",
          "basis": "种子模板基线"
        },
        {
          "id": "dispatch.params-from-env-local",
          "modality": "must",
          "text": "派发参数从本地 `.env` / `.env.local` 读（如 `YGG_SUBAGENT_MODEL` / `YGG_SUBAGENT_THINKING`），只用于派发选项；未设置时不显式传参，用 harness 默认。",
          "basis": "种子模板基线"
        },
        {
          "id": "dispatch.params-not-disclosed",
          "modality": "must-not",
          "text": "这类参数值不打印、不写文档、不进 commit、不进任何汇报。",
          "basis": "种子模板基线（凭据纪律的派发面）"
        },
        {
          "id": "dispatch.worktree-clean-before-dispatch",
          "modality": "must",
          "text": "派发前要求目标工作区干净（挂牌文件等本地标记除外）；脏树先收敛再派，否则执行方无法判断哪些改动属于自己。",
          "basis": "种子模板基线"
        },
        {
          "id": "dispatch.lane-serial",
          "modality": "must",
          "text": "同一工作区同一时刻只承载一个任务（泳道串行）；不同工作区可并行。派发前必检该工作区是否已被占用。",
          "basis": "种子模板基线"
        },
        {
          "id": "dispatch.executor-scope",
          "modality": "must-not",
          "text": "执行方（subagent）只做自己那一段实现 + 自检交付；集成、合并、部署一律由主 Agent 串行执行，不派给执行方。",
          "basis": "种子模板基线（收口单点）"
        }
      ]
    },
    {
      "id": "evidence",
      "order": 3,
      "title": "三、证据优先",
      "summary": "结论只能来自命令输出与退出码、产物文件、或读到的源码原文；不确定就说不确定。",
      "source": "通用基线（种子模板）",
      "priority": "standard",
      "applies_to": [
        "verify",
        "review"
      ],
      "rules": [
        {
          "id": "evidence.command-and-exit-code",
          "modality": "must",
          "text": "用命令输出与退出码作证；贴结论时同一段里给出实际命令与它的退出码。",
          "basis": "种子模板基线"
        },
        {
          "id": "evidence.artifacts",
          "modality": "must",
          "text": "用产物文件的存在性与内容作证（存在性 + 关键内容，不只说「已生成」）。",
          "basis": "种子模板基线"
        },
        {
          "id": "evidence.source-lines",
          "modality": "must",
          "text": "引用源码时给出 `文件:行号`，不给「我记得某处」。",
          "basis": "种子模板基线"
        },
        {
          "id": "evidence.no-impression",
          "modality": "must-not",
          "text": "不得凭印象断言；不写「我已完成」这类无证据的完成语。",
          "basis": "种子模板基线"
        },
        {
          "id": "evidence.uncertainty-declared",
          "modality": "must",
          "text": "不确定就说不确定，并给出「下一步怎么验证」。",
          "basis": "种子模板基线"
        },
        {
          "id": "evidence.uncovered-declaration",
          "modality": "must",
          "text": "未接通的检查项须在汇报里显式声明「未覆盖」，不得默认通过或省略不提。",
          "basis": "种子模板基线"
        }
      ]
    },
    {
      "id": "output",
      "order": 4,
      "title": "四、语言与输出",
      "summary": "中文对话、英文标识；先结论后依据；改前先读；机械改写先打印再落盘并回读校验。",
      "source": "通用基线（种子模板）",
      "priority": "standard",
      "rules": [
        {
          "id": "output.language-split",
          "modality": "must",
          "text": "与用户对话用中文；代码、标识符、路径、命令保持原样英文。",
          "basis": "种子模板基线"
        },
        {
          "id": "output.conclusion-first",
          "modality": "must",
          "text": "报错/结论先给结论，再给依据。",
          "basis": "种子模板基线"
        },
        {
          "id": "output.read-before-edit",
          "modality": "must",
          "text": "改文件前先读；改多个文件时逐个说明改了什么、为什么。",
          "basis": "种子模板基线"
        },
        {
          "id": "output.mechanical-rewrite-roundtrip",
          "modality": "must",
          "text": "大段机械改写（尤其 Markdown 树形结构与表格）先打印结果再写盘，写盘后立即回读校验。",
          "basis": "种子模板基线"
        }
      ]
    },
    {
      "id": "harness",
      "order": 5,
      "title": "五、Agent Harness 机制",
      "summary": "两层状态机 + 两个强制门禁 + 动作协议 + 异步入口 + 结算口径 + 改 Mod 三件套 + host 契约：这一章只说「机器怎么转」，项目自己的规则另立章节。",
      "source": "通用 harness 机制（种子模板）",
      "priority": "standard",
      "rules": [
        {
          "id": "harness.two-layer-state-machine",
          "modality": "must",
          "text": "认清两层状态机：**协调器**（intake → coordinate → review → done）只做派活、串行验收提案、过门禁、最终复盘，**不承载开发本身**；**需求级流水线**每条需求一条（draft → analyzing → planning → plan_gate → ready → developing → accept → done，另有 split / merged / dropped 终态与 blocked / stale 标记）。",
          "basis": "harness 机制"
        },
        {
          "id": "harness.mandatory-gates",
          "modality": "must",
          "text": "两个强制主 Agent 门禁不可跳过：plan 提案验收后的 **plan_gate**（批准才进 ready / 开发）；开发交付后的 **accept_gate**（批准才 done）。处于这两个状态的需求不能派活、不能被跳过，自动推进同样各走一次 `gate.approve`。",
          "basis": "harness 机制"
        },
        {
          "id": "harness.gate-bound-to-rev",
          "modality": "must",
          "text": "门禁绑定 revision：`gate_rev == req.rev` 才可批；待批期间该需求被 amend 即判 stale，旧批准不得覆盖新决定。",
          "basis": "harness 机制"
        },
        {
          "id": "harness.accept-is-not-approval",
          "modality": "must",
          "text": "`accept` 是**执行方自检并交付**，不等于主 Agent 已验收——`gate.approve` 才是核验；accept_gate 要求 **artifacts 非空**，不接受只有 summary 的完成自称。",
          "basis": "harness 机制"
        },
        {
          "id": "harness.action-protocol",
          "modality": "must",
          "text": "动作经事件派发、载荷是以竖线（`|`）分隔的字符串；回执里的 `pendingChoice` 就是**当前允许的动作集**（协议约束，不是提示词约束）——只在其中选，不臆造动作。",
          "basis": "harness 机制"
        },
        {
          "id": "harness.rejection-is-not-success",
          "modality": "must",
          "text": "被拒的派发不是成功：越阶 →「动作被拒」、载荷不合法 →「载荷被拒」、前置不满足 →「需求待办」、人类动作门禁拦住单发直派 → 同样是「动作被拒」。四者都原地重渲染、主状态不变，宿主据叙事前缀判为未生效。",
          "basis": "harness 机制（`rejectionPrefixes`）"
        },
        {
          "id": "harness.subagent-proposes",
          "modality": "must",
          "text": "执行方只**建议**：`proposal.submit` 的 `changes`（split / merge / amend / conflict）是拟议变更，`proposal.accept` 时才落地；执行方不得直接改共享状态。",
          "basis": "harness 机制"
        },
        {
          "id": "harness.serial-acceptance",
          "modality": "must",
          "text": "验收一次只处理一条需求（串行，按 requirement_id canonical 序取）；多条需求可同时在分析 / 规划 / 开发，但验收不并行。",
          "basis": "harness 机制"
        },
        {
          "id": "harness.stale-rebase",
          "modality": "must",
          "text": "验收时 rev 不匹配 → 提案与需求同置 stale（可读拒绝）；恢复路径是提交**同阶段、当前 rev** 的新提案——仅当该需求没有待验收提案时接受，仍有正常待验收提案时先 accept / reject。",
          "basis": "harness 机制"
        },
        {
          "id": "harness.async-inbox",
          "modality": "must",
          "text": "另一进程随时可经 **inbox**（JSONL，只追加）投递需求与提案；写命令与收口之间是协议级互斥（先登记写者，收口期切 closing、等在途写者归零再最后一次 drain，随后 finalized）。closing / finalized 阶段的写命令一律非零拒绝，不得重试绕过。",
          "basis": "harness 机制（跨进程协调）"
        },
        {
          "id": "harness.inbox-idempotent",